posted,item_id,recommend,review
2015-03-29,322330,True,Im hungry with friends just like real life
2015-03-29,219740,True,"Fun,Simple and hey is anyone getting hungry"
2015-03-29,304930,True,This game is simple and very fun its better to play with friends
2015-03-06,298630,True,this game is fun all the way and very strategic 10/10 would escape prisons again
2015-03-06,265630,True,It's High Noon
2015-03-06,317360,True,Jumped out a building as nick while shooting a guy 10/10 would jump out of building again
2015-03-06,105600,True,play this game....nom nom nom........ this game is fun game -heavy
2015-03-06,3390,True,feel that feeling when you bought this game its called nostalgia :D
2015-03-06,218620,True,Payday 2 is an amazing game it has fun 4 player co-op and sometimes the glitches are fun but to get the full potential out of this game you need to get the dlcs the dlcs are like parts for a machine that you have to build to make it better...im looking at you you broke ♥♥♥♥ piece of ♥♥♥♥ drill anyways there is kind mof a story but not really there its just shooting and heisting so 10/10 would recommend......*drill breaks*......FFUUUUUUUUUUU
