posted,item_id,recommend,review
2015-04-22,319630,True,Uma analise bem detalhada-Trilha Sonora Perfeita-Dublagem muito bem interpretada-Gameplay e história involventes dando peso a cada ação que você faz no jogo-Gráficos bons-Estilo de jogo diferenciado_____________________________________________________Em geral 'Life Is Strange™' é um dos jogos em que não pode ser citado sem envolver o termo Master Piece procedendo com uma história explendida._____________________________________________________Com relação aos bugs eu so encontrei 1 durante todo o gameplay mas nada que comprometa o jogo apenas um bug relacionado ao poscionamento da câmera.NOTA : 10/10__________Recomendações : Caso tenha gosta do estilo de jogo é interessante conferir o jogo 'Heavy Rain' para PS3 que segue no mesmo estilo de múltipla escolha com consequências.É interessante também conferir a trilogia de filmes 'Efeito Borboleta' cuja respalda o fenômeno também nomeado Efeito Borboleta que refere-se às condições iniciais dentro da teoria do caos o qual é retratado no jogo 'Life Is Strange™'__________Gostou da review ? Da um 'sim' aí ^-^ 'NO EMOJI - Chloe'
2014-05-17,4000,True,"Um jogo open Source muito ♥♥♥♥ com várias modificações , modos de jogo divertidos, e para os manjadores muita lógica em construções :)"
2015-10-14,104900,True,I got stuck in a rock.10/10I will get stuck again.
2016-02-05,204300,False,Eles nos atacam com DLCS.Se eu pudesse eu reembolsava ctz
2015-08-24,17520,True,Half-life 2 Multiplayer - 10/10
2015-02-02,317360,True,'HEADSHOT!' - (Still alive)Ok thats a pretty cool combination with 80s movies and gaming7/10
