posted,item_id,recommend,review
2013-04-09,8870,True,"What is BioShock Infinite? A surreal and thought out setting in a logically processed steam punk floating utopian city 'dubbed' Columbia, revolving around a beautifully performed actress that you will fall in love with the moment you meet her who is no damsel in distress; the combat is flawless. A game of 'Infinite' appraise from critics and fans alike, this game should be at the top of EVERYONES list for 2013."
2013-03-28,730,True,'The skill and tactical based master of all shooters'. Buy it.
2012-10-05,49520,True,Hilarious. Bizarre. Loot. Amazing.
2012-08-12,207610,True,"While not the CoD Rip off most people will be looking for, the non-linear story and characters do the the show and more importantly the graphic novel justice with multiple references and characters."
2012-07-08,440,True,Excelent Stradegy shooter with a comedic spin. Your not a steam member unless you own this game.
2012-02-11,22200,True,An abstract yet brilliant journey in a world reminiscent of the Oddworld games.
