posted,item_id,recommend,review
2014-11-19,319510,True,This is what happens with this game1. watch heaps of vids of it2. get the game3. act real tough and play it4. ♥♥♥♥ myself5. never play it againstill a great game but its scary first few times you play it
2015-01-05,202970,True,all i can say is this game is amazing! no lag at all!! No hackers its amazing!
2015-01-05,42680,True,This Game Is a great game but some games you get hackers that give you 1000000 xp when you kill them!!(not a bad thing :).   )
2015-01-05,730,True,I LOVE THIS GAME!!! ItS AMAZING GET IT ANYONE WHO OWNS STEAM!!!!
2014-12-23,332800,True,A little scary to begin with but when you get far in the game its really challenging and hard and make you want to delete the game but still an overall great game! i would recomend this game to anyone!!
2014-11-19,4000,True,This is one of the best games iv ever played!!! 10/10 would feel again!!! worth all the 10 dollars
