posted,item_id,recommend,review
2016-07-11,273350,True,"Good game now that its free to play, i expect more people to try it out meaning more people online to play with, the matchmaker is actually quite good and quick but there is not tutorial on how to use perk system, good customisation options and everything came be earned by in game credits or (keys). look out for that 10 million key bounty"
2016-03-26,242860,True,"This game has come a long wayy since its first release to the public, the mechanics have been imporved dramatically over this last patch, the player models looks very detailed and the game will run well on most laptops, i fully recommend you pick this game up before a price rise. very happy with my purchase"
2015-04-29,346900,True,"Good game, querky, good time waster. $$$$$$$$$$$"
2014-11-22,48700,True,"IF U NO HAVE THIS GAME I H8 U, SO MANY MODS AND STORY TELLING IS INCREDIBRU!!!"
2014-07-25,244850,True,AMAZING GAME!!! IF ONLY I HAD A BETTER GRAPHICS CARD :(
