posted,item_id,recommend,review
2016-01-05,389570,True,"Agar.io with less lag! And in steam! Agar.io is in the internet. If you say it has lots of lag, Your computer must be old."
2015-12-18,391540,True,I dont feel lonely anymore
2015-08-23,49520,True,i still play it.
2015-08-16,387860,True,Fun. But really hard to understand.
2015-08-02,51100,True,A non-rich Cs:Go
2015-07-17,239450,False,"Gun monkeys, First of all the title dosent match. Second, its a 2D really bad game.DONT BUY IT DONT BUY IT DONT BUY IT"
2015-07-14,570,False,Full of russians.
