posted,item_id,recommend,review
2014-03-17,247730,True,Package Run Simulator 2014
2013-12-22,265210,True,A amazing game. A most have for Christmas gamers and gamers who like a bit of a challange and humour. This will keep you entertained for hours.
2014-04-04,208090,False,LOLOLOLOLOL.This game is shutting down guys. They closed the Australian Server so now I can't play without lag. Spent real money on it just to be let down....
2014-07-11,221100,True,Masturbated and ♥♥♥♥ed my pants whilst looking at a female zombie.10/10
2014-07-05,730,True,Killed a chicken with a $50 AWP. 50/10
2014-01-07,219680,True,Had a little bit of fun. Certainly relaxes the soul. I got it for sale for $2 so I would say money well spent.
