posted,item_id,recommend,review
2014-06-17,261760,True,"Haven't played since release. Was a good concept then, heavy on a basic laptop, and likely better now."
2015-02-12,271290,False,Abandoned by the Devs: DO NOT PLAY!
2015-01-22,290340,True,Backed it and love it. The devs are great and have crafted a beautiful game. Sucks to be you guys who didn't get the KS swag
2016-06-03,413150,True,Old fashioned farming game; love it
2014-10-02,233250,False,I don't know if it is my fault or what; but even with my laptop that meets the minimum requirements the game crashes when i try to enter a match. There needs to be a good amount of optimization done for the wider spectrum of hardware used
2014-09-29,293240,True,Love it
2014-09-12,214190,False,"It's a fun game, but still unbalanced and NOT a full release"
2014-05-03,55230,True,Pretty dec game; pretty dec indeed.
