posted,item_id,recommend,review
2015-07-07,211420,True,'Your framerate is insufficient for online play'
2015-06-13,323470,True,10/10 can create original character
2014-04-07,223710,True,is gud but scarry
2014-02-22,221640,True,Not recommended to those with a history of epileptic seizures.
2013-04-19,105600,True,You shoot lasers at Space Cthulhu.Space Cthulhu is the final boss.
2013-04-19,4000,True,"666 hours, time to stop playing."
2013-04-19,440,True,"Excellent FPS, but don't get sucked into the metagame.Just don't."
