posted,item_id,recommend,review
2016-03-18,373360,True,"Very, Very Fun. One of the best games I have ever played for a long time! LOVE IT SO MUCH Keep Up the good work Dev!"
2016-04-28,244850,False,The game is not worth $30. It's a $5 game at most!
2016-07-19,319630,True,This is one the best game I have played.The best parts of this game is how what you say really matter and will change the story immensely.
2016-02-06,212070,True,Great game it's a game i really love playing it!
2016-04-23,270550,True,This game is very fun and explosive. For it's price the game is worth it and you will find many hours playing it. The gameplay is enjoyable and fast paced!
2016-07-23,496920,True,Just wow
2016-01-29,304930,True,Very fun to play with friends
2016-01-25,238960,True,It's a game you will never get sick of!
2016-01-08,4000,True,Great Game!
