posted,item_id,recommend,review
2014-12-28,286500,True,cool game and cool story
2015-02-28,247000,True, i like this game but idont have a friend to play with because they dont have it**feeling lonely* * :((
2014-12-19,265330,True,cool ^ ^ game
2015-02-02,227220,False,idont know but its white screen on my laptop so sad :((
2015-01-07,334930,True,fun game cool puzzle buy this guyz - make a machine-create and combinei give this 7/10
2014-12-20,280930,False,fake game i buy it and start it already game crash report lose money damn not good game
2015-01-15,256410,True,awesome gamebut idont know how to use the tournament ticketplease tell me how to use or there is lvl that can be on tournament
2015-01-05,38600,True,good game
2014-12-20,259550,True,i give this a 10/10good game clicking . .finding mushroomz and other stuff little hard because mushrooms so little but i complete the achievements of ittry this its nice game
