posted,item_id,recommend,review
2014-12-07,330840,True,"Старина Рэмси 'Я ПОКАЖУ ТЕБЕ, ЧТО ТАКОЕ БЕЗУМИЕ, МВАХАХА!!!' Болтон, зловредная стерва Серсея, хитрожопый лорд Трайон, накал страстей, интриги, мозгоразрывающие сюжетные ходы и вообще всё-всё-всё - всё это на месте. Именно этого я ждал от 'Игры престолов'. Лучшая игра Теллтейл, задвинувшая не только надоевших мертвяков, но даже и Волка. Боже, благослави Telltale за этот бриллиант."
2015-03-21,330830,True,This game is in 'must have' category by virtue of having the shiniest meat bicycles.
2014-11-29,237850,True,"If i ever marry a girl and we adopt a child, it will be a bot."
2014-12-04,258180,True,"Nice game, nice locations, nice sounds, nice plot, nice everything. Only bad things: 1) can't jump 2) in-game purchases with credits 3) GUI which sucks balls. Not counting it, it's an epic win whatever piles of ♥♥♥♥ haters can ♥♥♥♥ upon this little game. 9/10 and totally worth playing."
2014-11-21,263820,True,Too evil.
2014-11-22,331470,True,"Красивые вайфу (почти все богини, кроме мерзкой сучки Ульяны), малопонятный сюжет с тёмными пятнами, множество кульутрных аллюзий на совковкую реальность. 9/10."
