posted,item_id,recommend,review
2015-03-26,244850,True,10/10 would die by landing gear again!
2015-07-24,105600,True,One of the best game's on steam i don't see the comparisons to minecraft thou because minecraft and terraria are extremely different. Terraria is a 2D dungeon crawler light rpg game it is worth the price tag.
2015-06-22,232090,True,This game is great with friends enjoying alot of my time with it the only problem is that on biotics lab i can get stuck on a plant but other then then a great game.
2014-05-24,221100,True,DAYZ is a great game with friends but be warned you may lose you save you have be warned.
2014-04-23,42910,True,Awesome must get great silly multi player.
