posted,item_id,recommend,review
2015-02-04,346010,True,create the most disasterous peices of ♥♥♥♥ to win11/10 would accidentally win again
2016-03-01,422970,True,You will be lucky to survive for 30 seconds.10/10 would get my ♥♥♥♥ kicked again
2015-12-05,25010,True,cancer
2016-07-27,496920,True,i read the recommendations for this game and someone said there was a plot twist.i was expecting another m night shymalan plot twist.this time i got an actually interesting plot twist which makes me want another game like this but with more features and story addedpreti goed
2015-11-06,357330,True,shrekt
