posted,item_id,recommend,review
2013-12-08,320,True,"Is good game, comrades lets keep infesting servers is good idea no lie."
2014-03-10,220,True,Best North Korea simulator
2013-12-24,38420,True,"Damn, this games hard :( 8473/10"
2014-01-04,38400,True,Still would of became Bethesda's fallout ....if the company didn't burn and cry for water but sadly knowing its fate......hell it would of been even better than Bethesda's fallout
2013-12-08,80,True,Hardest campaign I have ever played..... Love it
2010-12-18,440,True,best game made ever
