posted,item_id,recommend,review
2014-08-20,304930,True,Don't killing   players and not aswers !!!
2014-03-14,208090,True,polecam tą gre bo jest fajna i cool  bo tf 2   troche super a loadout SUPER MEGA    FAJNE
2014-01-15,200210,True,fajna  gra          bije sie tam    potwory i  piratów i  znajduje się  przejścia  i można gadać   lub   sie  ozdrawiać i dawać swoje   inne  dobre itemy  i   many
2014-03-15,630,True,Fajna gra jest super bo  ma sie  4 ludzi co  pomoże w  walce z obcymi złymi   potworami zielonymi ale kiedy sie gra w alien swarm to sie dostaje   czapke  potwora z  Team Fortress 2  i  jest  za darmo ! :P  : uwaga jak  komentasz  polecania  gry tej  to daj  +rep i  napisz    super   ten komentasz  :D .  ale kiedy grasz tą gre  wybieraj technika  i medyka   i  innych   medykuw  są w tej grze  męszczyzni   i kobiety  dowidzenia  nie zapomnij  o  +rep  i  super   mega komentasz
2013-12-07,206500,True,jest fajna ta gra ale   ci  gracze nie bo niszczą   sprzety i    vote kickują wienc   na survival  i classic  nowe gry
