posted,item_id,recommend,review
2016-04-28,270370,True,sick game but add vehicles
2015-11-08,268650,True,cooooooooooooooool
2015-07-06,224540,True,meh
2015-07-06,219640,True,SIIIIIIIIIIIIIIIIIIIIIIIIIIIIIICK game make sure to watch out for you teamates they could kill you also go for teamkills whilst watching out for the enemys ;D
2015-07-06,233450,True,fun little addictive arcade game i like to mostly build in sandbox rather then play game.
2015-07-06,440,True,Wow Addicting muchMaybe more hats please??
2015-07-06,4000,True,"Would Reccomend, HEAPS OF THINGS TO DO IN THIS GAME.I like to play Gmod DarkRP, dark rp is fun because you can meet heaps of people from weird people to normal fun people.10/10- so much stuff to do in gmodGmod more like woah i havent even played everything but i have 3k hours???"
2015-05-25,236390,True,ye
