posted,item_id,recommend,review
2012-02-06,220,True,This game is Epic. Its full of awesome guns and lots of area to explore the story is great too overall this game is definetely worth buying 10/10
2013-01-04,50650,True,"This game is very fun to play and is challenging in some parts. I like the combat because you can do different combos, depending on what mouse buttons you click.9/10"
2012-06-23,570,True,Dota 2 is an epic game of skill and strategy and is extremely fun to play. I recommend this game to all that know a little bit about strategy games. 10/10.
2012-04-19,72850,True,"Skyrim is an amazing world of awesomness the main questline is just really good, the levelling system is great too,and that you get to play as the all mighty DRAGONBORN!, the shouts are awesome too. one of the shouts is a voice distraction and it can say 'Hey, skeever butt'. I highly recommend this game to anyone. 10/10"
2012-03-18,620,True,"This game is amazing. It has great storyline, characters and it is a really good puzzler.I recommend this game to everybody. Portal 2 is the best game ever!Thank you Valve!"
