posted,item_id,recommend,review
2014-07-03,218230,True,"This game is great, 10/10 I love this game mainly becasue it puts you in the shoes of a real time futuristic soldier. The combat in this is exceptional and is very realistic. I would certainly try this :)"
2013-11-29,13140,True,This is a fun game although because it is a military simulator it can get a little boring. Overall it is a great game :)
2016-01-28,393380,True,"12/10This is the best game i have currently played, the audio in the game is unreal. Combat is different every time and extremely intense. If you like Mil sims that are actually fun buy this game.Cant really explain the experience until you have played it."
2015-01-17,231430,True,Great game :)
2014-02-14,252490,True,One of the best games i have played 11/10 :)
2013-12-30,209870,True,This game is a great FPS. It is by far one of the best shooter games i have played and the customization for the weapons and the player is just amazing. It took me a bit of time getting use to the controls and the fast paced action but overall i rate this game 5/5 :)
2013-12-16,47790,True,"Great game, love it!!!"
2013-11-30,91310,True,This game is great especially when it is only $20. It has a addictive storyline and the things you can do in this game is great.I recommend this game to any gamer.
