posted,item_id,recommend,review
2015-07-11,271590,True,"GTA V is one of the best open-world video game that has ever been created. Love it or hate it, it's a fact. Look it up"
2015-09-09,265930,True,The farmer nearby my home complained - why r u hurting those people??'cuz a goat gotta hav sum stylez'420/10wish i was a goat
2015-09-09,332570,True,"When you fantasied about an animal too much, you made them as an OP god-like protagonists1337/Frog Frogs > goats"
2015-09-09,284160,True,"Tired of some generic racing games? why not try this over-the-top car crashing simulator?it contains a lot of good stuffs, like:+ Trains you how to be a good driver+ Shows what will happen to the car if you crashed it to something (like really it's the point of the game u ♥♥♥♥)+ Has a better driving and crash physics than GTA V+ Really dope vehicle modelsthe negative side?- it lacks on characters.. (i request Paul Walker)- no story (dafuq?)9/10 still better than the latest NFS games"
2015-09-09,4000,True,You can buildYou can have funYou can destroy ♥♥♥♥You can spawn stuffYou can make ragdoll masterbaitYou can make rapeposeYou can be anything....at anyime..anywhere..wheneverAND.. whereeverYOU WANT10000/10 would sell my life for dis gaem+plus workshop addons *totally f-ing recommended
2015-09-09,440,True,My money = Dis Game10/10 virtual hats > real hats
2013-08-27,206420,True,A perfect addictive game to play before GTA V :)
