posted,item_id,recommend,review
2016-08-24,362930,True,Got gifted this game by a friendLets just say I have one less friend-Sincerly Bread
2014-06-23,8190,True,i was riding on a jet it blew up and I landed a a person with a cone hat 10/10
2016-07-02,214490,True,10/10 wouldn't play again
2015-02-13,250900,True,This game THIS GAME has so much content and lots of fun things that you can do and i cant reommend this game enogh
2015-02-13,113200,True,I would write a review about this game but it would ruin the fun
2013-12-24,440,True,is the best game ever thats f2p...
