posted,item_id,recommend,review
2016-03-22,213610,True,10/10 because chaos
2015-10-08,200510,True,my best soldier saw his fellow soldier explode and decided the best action was to kill his another soldier and then get shot 10/10
2015-12-26,417860,True,:'(
2015-10-08,211420,True,you will cry and you will keep playing
2015-10-08,107100,True,short but sweet and just amazing must play
2015-01-20,205100,True,this games amazing ever since i first started playing i was instantly immersed in it giving a really cool play your own way system. I only wish i got this game sooner
2013-12-29,201790,True,loved this game deffinite recomend
