posted,item_id,recommend,review
2015-11-24,336520,False,"Goodness - take me bak 15 years and this would ahave been a resonable game - gameplay, interface, and speed of game is poor all things considered."
2015-07-07,306130,True,Enjoyable game - reasonable graphics - lots of quests and side chains. very customazable charachters. Purchased montly sub as I enjoyed it so much!  great way to encourage subscribers.
2014-09-29,113420,False,Not my thing
2014-05-10,263540,True,not very playable at prpesent - interface is very laggy and clumsy
2014-02-12,252490,True,Good game. in Alpha Stage I can has great potential as a survival game! addictive as heck!
