posted,item_id,recommend,review
2015-01-25,252490,True,"This game is the features naked man nude men, men are not wearinng a clothesThis game can craft , survival , kill people kill montage , crafting any weapon or building a house .I like this game is was fun but it has a little problem bug but it not a problem to play this game .9/10 Enjoy XD."
2014-11-02,218620,True,It have a infamy i like this game very much 10/10 :D
2013-11-29,242800,True,Very good survival game :D
2014-12-01,220700,True,It was very easy to use the software is great! Lots of tiles and objects you can select from.You can built your RPG Maker from yourself guys :D
2014-01-01,219150,True,VERY ROCK AND INDIE GAME10/10
