posted,item_id,recommend,review
2015-05-30,212070,False,The low tier waiting times are way too long. I've been waiting for 10 mins and haven't got a game.
2016-03-25,248820,True,"Awesome game, though chaotic. You start off with a few monsters spawning then the second you get to the next stage, you get 50 monsters trying to feast on you. Death messages are amazing and the items captions are hilarious. 11/10, most chaotic game ever."
2015-12-06,323610,True,"Loved it, I reccomend getting the Los Angeles mod by Hoppah. It's a great game without the mod but the mod makes it even better. 10/10, Would explode again"
2015-11-04,255710,True,-Started game-Built a SimCity city-Failed-Restarted-Build a random thing-Placed a water pump in a river full of poop-Everyone died10/10 Would kill everyone again
2015-05-08,301520,False,"People are always underground, rails are to OP and they've screwed up areofoils.GG Robocraft."
