posted,item_id,recommend,review
2014-04-12,243870,True,great fun game love every time i played it
2014-05-11,230410,True,this game is soooooooooooo good but the one thing u need to do is put atleast 50 bucks into it for it to be fun lasting
2014-01-09,219640,False,this game has been giving me ♥♥♥♥ from the start i cant start the game with out it crashing and i have not even been able to play it at all dont buy it untill they fix it
2013-12-29,244850,True,this game is great fun on single player and soon to be multiplayer cant wait i recommend this game to anyone that likes mincraft 
2013-12-19,221100,True,its a bit buggy but its still in alpha so yea i have only play  a few hours on it but had so much fun
2013-04-08,226700,False,this game is ♥♥♥♥ dont play
