posted,item_id,recommend,review
2015-03-14,35450,True,Great game definitley recommened it but the servers are not that easy to get on to  but other then that it is awesome
2016-06-20,386360,True,Awesome game definitely recommended
2014-05-06,17300,False,This game was onistly very very bad i like crysis 2 and 3 but this one was i am just going to say it ♥♥♥♥ it crashed a lot it inpossible to win because every 5 minutes a helicopter would show up the tank battles where ♥♥♥♥♥♥♥♥ because you would shot one tank it would take one hit then the next tank 10 hits and then you run out of ammo and it is still not destroyed so it was not aavery good game. P.S. DO NOT BUY THIS GAME IT IS A WASTE OF MONEY AND TIME.
2015-01-29,4000,True,awesome!
2014-10-16,241930,True,awesome game definitly recamened it
