posted,item_id,recommend,review
2016-07-04,226320,True,can some1 tell me how to get free costume?
2016-05-28,235600,True,"Fun and Stealthy.Co-op is damn good.The only problem is on multiplayer..The Spies vs Mercs need more balance on equipment especially on lvl,because.. I'm just getting fcked up by high lvl players :^)"
2016-01-14,230410,True,-Cornered by lvl95 bombard-Press invisible skill-The enemies walk away like nothing happens10.5/10
2015-08-02,400,True,I completed the achievements
2014-09-20,440,True,10/10Try it now
