posted,item_id,recommend,review
2014-03-14,204360,True,This is to op for people but my  friend and i ♥♥♥♥ing finish it yeah!!!!!!!!!!!!!!
2014-11-12,202970,True,This is a really good game it was the best bgame activision made.Also its better than call of duty advanced warfare and call of duty ghost.Therefore this is the best cod game overall u guys should buy this there is also zombies in it so u guys should buy this game plsss just buy this game and  then play with me!!!!!!!!!!!!!!!!!!!!!!!! 
2014-07-03,218620,True,This is a really nice game!!!!!!!!!!!!!!
2014-02-15,208090,True,Dsmn this game is good and funny as hell you guys should download it and the good thing its free!!!!
2014-01-25,219640,True,This is a mother♥♥♥♥ing awsome game you guys should buy it!!!!!!!!
