posted,item_id,recommend,review
2015-11-12,389570,True,este juego es la ♥♥♥♥ hostia como agar.io pero en este tienes niveles y habilidades es muy mejor me encanta ojala que un dia lo mejoren mas :D  me llamo slingshot  que lo escribio bye
2016-05-17,304930,False,♥♥♥♥♥♥ de juego no veo a perdsonas y veo que los zombis golpean al aire y el zombi muere y escucho disparos  y no veo a la genta y me mata alguien desde yo se que donde
2015-12-05,218620,True,mejor juego que egh jugado  recomiendo que lo lo conpren la graficos son una ♥♥♥♥♥♥ lo se pero algo algo no  bueno gente espero que lo conpren bye :3
2014-11-22,319510,True,me gusta este juego por que me gusta vigilar cosas y ademas me interesa mas por la muerte del tipo del telefono ok estabien hoygan me hacen un fabor eh recien estre y vi que five nigths at freddy s y se be  hacia la derecha ok adios
2014-09-01,49520,True,BORDELANDS 2 ES UNA ONDA DE JUEGO NO ESTA E INGLES EL FINAL ES EPICO COMPRENLO POR QUE PUEDO JUGAR CON AMIGOS :D
