posted,item_id,recommend,review
2014-10-11,113020,True,"Before I even say anything, I love the guard AI.'Hey, Pierre. I keep hearing these strange sounds behind me.''I know right? It's weird. Everytime I turn around to look at it, all I see is a big gaping hole in the wall.''Damn straight. Not only that, but these damn theives keep disappearing.''Tell me about it. I'm chasing a guy armed with a sledgehammer, but he runs around a corner and poof! He's gone.''Huh. Well, keep a look out for anyone not in a suit or dress. They're obviously imposters.''What about that guy in the suit with the rocket launcher? The one aiming at us right now?''Nah, he's cool. He's got a suit, see?'TL;DR: It's fun as hell. Go for it, man. Buy the damn game."
2013-09-09,219150,True,I feel like Oprah when I play this game.YOU GET A PUNCH...AND YOU GET A PUNCH...AND YOU GET A PUNCH...EVERYONE GETS A PUNCH!
2013-09-09,1250,True,A typical horde simulator until the patriarch shows.Then a massacre even worse than the 2014 Brazil World Cup begins.
2016-03-13,294860,True,"I sent a teenage girl from a bakery into battle during WWII.I gave her a gun and some grenades. Told her to go defeat the enemy.I sat in my tank and watched.She came back 2 turns later.'I eliminated all enemy forces.'German war tactics are trash, Blitzkrieg ain't got ♥♥♥♥.This is true warfare."
2015-04-01,245170,True,Playing Skullgirls with a keyboard is frickin' impossible.10/10 would rage again.
2013-09-09,28050,True,I never asked for this.
