posted,item_id,recommend,review
2014-06-26,218620,True,"Eu desde pequeno que o meu sonho era assaltar um banco , graças a este jogo , tive essa oportunidade de assaltar não um banco , mas sim  vários bancos . Recomendo profundamente a compra deste jogo porque vale mesmo a pena assaltar uns bancos de vez em quando para nós conseguirmos ' sobreviver ' em Portugal ."
2014-07-03,113400,True,"Este jogo é engraçado especialmente com amigos , recomendo bastante este jogo porque gosto do facto de pudermos personalizarmos as nossas roupas , armas , carros enfim tudo ... Porque não experimentar um jogo que é grátis , na minha opinião um dos melhores ' Free To Play' na steam na minha opinião.Avaliação - 7/10 Razão : Demora bastante a entrar Estás à espera do que para começares a jogar e divertires-te?"
2013-09-28,730,True,"O cs:go é um jogo que toda a gente gosta de jogar especialmente com amigos , porque tem mais diversão do que jogar individual . Aconcelho vivamente a comprar este jogo , pois eu acho que vale a pena o dinheiro por o mesmo."
2013-09-28,440,True,Bom jogo de F2P
2015-08-31,356070,True,I really like this game.
