posted,item_id,recommend,review
2014-06-29,4000,True,"Dont even know how to play the game, but just get it cuz yolo 11/10"
2014-04-26,221100,True,If you like running for hours looking for a decent weapon and then suddenly getting held up by bandits who take your pants and shoot you in the face after then take your ♥♥♥♥ then this is definitly a great game.
2012-10-18,440,True,I recommend this game simply because you are gay and i like eating donky rainbows and fighting cows on marijuana.
2015-07-04,312930,True,best demo 11/10 IGN
2016-04-15,8930,True,its aight
