posted,item_id,recommend,review
2016-03-04,413150,True,After 3hour of playing.......   Well This Game Is Pretty Damn GoooooooooooooodWhat about This game-Farming-Hunting-Building-Dating-Petting-Cutting-Mining-Selling-Buying-Working-Planting-Running-Walking-Riding-Finding-Reading-Thinking(I Can't Find And -ing Anymore)But.... Trust Me This Game Is Dat Beast          Oh......      Nothing
2014-01-25,250400,True,It awesome game but u know every game have fun if it have a friend :D [buy it and play with me C:]
2016-09-01,730,True,When You Have 900Hour And Everyone Said u Hack
2016-04-08,391540,True,This Game Actually Make Me Cry
2014-03-17,33230,True,It nice game you can parkout everywhere and cool story
