posted,item_id,recommend,review
2013-12-15,249050,True,Simple roguelike elements with some 'tower' building strategy. Promising and playable!
2013-12-10,730,False,Go with CS:Source.
2013-11-13,248820,True,Very challenging. Highly replayable. The variety and strength of the loot is motivating and the unlockable characters on offer are unique and fun in their respective gameplay styles. This fast paced action platformer is a real favourite of mine.
2013-10-24,238960,True,"This is the true sequel to Diablo II. And, it's fricken amazing."
2013-07-23,6420,True,A very good tactical game and super cool if space and pewpewlazerz are your thing. The big downfall is a lack of sandbox mode.
2013-07-18,200510,True,"Made for the masses and wow, this time the industry didn't ♥♥♥♥ it up. X-COM lives again! A tactical great."
2013-07-13,220200,True,"An absolute winner. The mod scene is where it's at, too."
2013-01-05,8800,True,The peak of Civilization and one of the absolute best in 4X.
2013-01-02,219740,True,"If survival games are your thing, hit it."
