posted,item_id,recommend,review
2016-01-05,353370,True,SUPER COOL!!!!! I use it all the time the typing is okay got to get used to it but its most defienly helpful
2014-06-06,224260,True,Its scares me
2013-12-15,70000,True,THIS GAME IS THE GAME I HAVE BEEN DREAMING OF WHEN IT COMES TO FIRST PERSON SHOOTER GAMES AND IT HAS DINOSAURS I LOVE DINOSAURS!!!!!!!!!!!!!!!!!!!!!!!!!! YOU HAVBE TO BUY THIS BLOODY GAME ITS FREAKING EPIC AND OCCASHIONALLY YOU GET TO BE A T-REX THATS BETTER THAN ANYTHING!!!!!!!!!!!!!!!!!!!!!!!!!!!!!!!!!!!!!!!!!!!!!!!!!!!!!!!!!!!!!!!!!!!!!!!!
2015-11-17,109600,True,very awesome makes me smile reminds me of the origonal dungonds and dragons :3
2016-01-09,286100,True,beautiful but i got stuck XD
