posted,item_id,recommend,review
2014-12-06,310380,True,"this game is really awsome, just very laggyselling copies of the game"
2014-06-14,17080,False,"horrible ♥♥♥♥ing game. wont even start up. no one downlaod this game, its a waste of time"
2012-08-18,730,True,soooooo awsome
2016-01-30,252490,False,this game sucksrun around the entire map and your fineget attacked by a bear that spawned on you and dying is ♥♥♥♥♥♥♥tand my favourite part it that i ran to my body and it had despawned before 4 minutes wtfand you know all my guns despawn with the body but not the axedont play this game youll get cancer
2015-12-15,412470,True,this game is very fun. i dont see the p2w right now. i am level 5.it is a lot like wot but i love the respawning. makes dying a lot less frustrating
2014-08-21,227940,False,do not get this game it ♥♥♥♥en sucks in every way.
2015-03-08,99900,False,"♥♥♥♥♥♥ game, if you are looking for a good gme dont look at this one. 0/10 would play again"
2014-09-14,4000,False,if you want a game that dosnt take 5 years to load dont get this
2012-03-21,440,True,this game is awsome
