posted,item_id,recommend,review
2013-12-06,109400,True,"Otimo jogo , apesar de free muito melhor do que alguns pagos... esse jogo tem um grafico muito agradavel e bonito alem disso os mapas dele são bem divertidos... é um otimo jogo para jogar com um amigo.."
2014-01-29,440,True,"Muito Viciante , um jogo de FPs com uma ideia diferente e alem disso para quem gosta tem alguns mods muito bacanas fora isso sistema de trocas... Recomendo esse jogo!!"
2014-06-13,281370,False,a ♥♥♥♥♥ ! nem compra vei !
2013-11-29,730,True,"Bom , apesar de eu prefirir os tempos de cs 1.6 esse jogo da para passar um tempinho... ele tem a mesma pegada mas mudaram um pouco de algumas mecanicas que acabaram estragando um pouco , interessante é que tem novos modos , e servers BRS da valve, alem disso tem as skins de armas que não influenciam no jogo mas deixam as armas ♥♥♥♥s para quem gosta desse tipo de coisa.."
2013-11-29,48000,True,"Recomendo a vocês , é um jogo fantastico e não é tão caro alem disso ele mistura muito o genero de explorar o mapa com um misterio que apresenta no jogo outra coisa é que ele tem diversos puzzles não muito dificies mais que dão um acressimo de qualidade no jogo eu concerteza recomendo este jogo!"
2014-02-05,208090,True,♥♥♥♥ xD !
2016-07-14,291550,True,"Muito bom lembra os tempos de super smash , otima jogabilidade e é realmente free to play não é akele pay to win !!"
