posted,item_id,recommend,review
2014-07-01,236450,True,"Brings me back to the good-old PAC-MAN days, but now with slow-mo and alot of flashy colors. 9.5/10"
2014-02-05,730,True,"Fun for all ages, 10 and up"
2013-10-11,39000,True,JOHN MADDEN!!!! JOHN MADDEN!!!! JOHN MADDEN!!!! JOHN MADDEN!!!! JOHN MADDEN!!!! JOHN MADDEN!!!! JOHN MADDEN!!!! JOHN MADDEN!!!! JOHN MADDEN!!!! JOHN MADDEN!!!! JOHN MADDEN!!!! JOHN MADDEN!!!! JOHN MADDEN!!!! JOHN MADDEN!!!! JOHN MADDEN!!!! JOHN MADDEN!!!! JOHN MADDEN!!!! Football! aeiou  aeiou  aeiou  aeiou  aeiou  aeiou  aeiou  aeiou  aeiou  aeiou  aeiou  aeiou  aeiou  aeiou  aeiou  aeiou  aeiou  aeiou  aeiou  aeiou  aeiou  aeiou  aeiou  aeiou  aeiou  aeiou  aeiou  aeiou  aeiou  aeiou  aeiou Holla holla get $ 9999999999999999999999999999999999999999999999999999999999999999999999999999999999999999999999999999999999999999999999 I'm laughing for real right now! brbrbrbrbrbrbrbrbrbrbrbrbrbrbrbrbrbrbrbrbrbrbrbrbrbrbrbrbrbrbrbrbrbrbrbrbrbrbrbrbrbrbrbrbrbr
2013-07-10,233720,True,Reasons to buy this games Achievement has a picture of the Tardis You can use a Sonic screwdriver10/10
2013-07-10,440,True,Satisfactory.
2014-11-23,274250,True,2/10 Too much water - IGN
2013-08-14,226980,True,Fell in love with Pinball as a child. Nice to come back and play a good Pinball game. 7.8/10
2011-05-10,630,True,My experience with Alien Swarm Stole some dudes flamethrower10/10
