posted,item_id,recommend,review
2014-01-04,105600,True,good game similar to minecraft but still fun
2014-07-04,12140,True,it was a good game but the bullet time is so op
2014-02-17,280,True,for the graphics of their time these are amazing graphics
2014-01-02,500,True,Ok this Game is ♥♥♥♥ing great buy this both games are fantastic but in a way i like this one better because i like the graphics and how the weapons say ok when people say but the first one do what u want but this one is better to me
2013-12-08,261980,True,good Mod short but hella fun
2013-12-01,620,True,SO MUCH LONGER THAN THE 2 HOUR PORTAL BUT ANYWAYS THIS IS THE BEST GAME SINCE  SLICED BREAD : THE GAME
