posted,item_id,recommend,review
2014-08-30,113420,True,Got molested in a cave by Mutated Ants10/10
2015-04-10,238960,True,Like Diablo10/10
2014-12-21,4000,True,"Build Stuff, Kill Stuff, Mod StuffThe Game is endless and full of fun10/10 'Yeah its alright, got a bit to much water for our taste' -IGN"
2014-12-18,322330,True,Was chilling with my Mate at our newley made CampsiteChowing down on some good ol Monster Meat3 Seconds later get massacard by a pack of steroid infused wolves10/10 Get this game now!!!
2014-12-14,6060,False,"My computer is more than capable of running this game yet i am faced with low FPS.I can hardly get the game open let alone play it, this is a disgrace.I would not reccomend this game as for bugs like this."
2014-10-31,208090,True,Can be Naked and kill people10/10
2014-10-30,304930,True,Found a Ghillie Suit and shot some people.10/10 Would play again
