posted,item_id,recommend,review
2016-07-12,224260,True,Suicide had never been so dramatic.9/10
2015-04-25,72850,False,__________████████_____██████_________█░░░░░░░░██_██░░░░░░█________█░░░░░░░░░░░█░░░░░░░░░█_______█░░░░░░░███░░░█░░░░░░░░░█_______█░░░░███░░░███░█░░░████░█______█░░░██░░░░░░░░███░██░░░░██_____█░░░░░░░░░░░░░░░░░█░░░░░░░░███____█░░░░░░░░░░░░░██████░░░░░████░░█____█░░░░░░░░░█████░░░████░░██░░██░░█___██░░░░░░░███░░░░░░░░░░█░░░░░░░░███__█░░░░░░░░░░░░░░█████████░░█████████_█░░░░░░░░░░█████_████___████_█████___█_█░░░░░░░░░░█______█_███__█_____███_█___██░░░░░░░░░░░░█___████_████____██_██████░░░░░░░░░░░░░█████████░░░████████░░░█░░░░░░░░░░░░░░░░█░░░░░█░░░░░░░░░░░░█░░░░░░░░░░░░░░░░░░░░██░░░░█░░░░░░██░░░░░░░░░░░░░░░░░░██░░░░░░░███████░░░░░░░░░░░░░░░░██░░░░░░░░░░█░░░░░█░░░░░░░░░░░░░░░░░░░░░░░░░░░░░░░░░░░█░░░░░░░░░░░░░░░░░░░░░░░░░░░░░░░░░░░█░░░░░░░░░░░░░░░░░░░░░░░░░░░░░░░░░░░█░░░░░░░░░░░█████████░░░░░░░░░░░░░░██░░░░░░░░░░█▒▒▒▒▒▒▒▒███████████████▒▒█                                          ░░░░░░░░░█▒▒███████▒▒▒▒▒▒▒▒▒▒▒▒▒▒▒▒▒█░░░░░░░░░█▒▒▒▒▒▒▒▒▒█████████████████░░░░░░░░░░████████▒▒▒▒▒▒▒▒▒▒▒▒▒▒▒▒▒▒█░░░░░░░░░░░░░░░░░░██████████████████░░░░░░░░░░░░░░░░░░░░░░░░░░░░░░░███░░░░░░░░░░░░░░░░░░░░░░░░░░░██▓██░░░░░░░░░░░░░░░░░░░░░░░░██▓▓▓███░░░░░░░░░░░░░░░░░░░░█▓▓▓▓▓▓███░░░░░░░░░░░░░░░██▓▓▓▓▓▓▓▓▓███████████████▓▓█▓▓▓▓▓▓▓▓▓▓▓▓▓▓▓▓▓▓▓▓▓▓▓▓▓▓▓██▓▓▓▓▓▓▓▓▓▓▓▓▓▓▓▓▓▓▓▓▓▓▓▓▓▓▓▓█▓▓▓▓▓▓▓▓▓▓▓▓▓▓▓▓▓▓▓▓▓▓▓▓▓▓▓▓▓█'Feels bad man.'
2015-02-08,35091,True,Got a blackmarket drop from the highest point in the game and went for a ski trip down the mountain.
2015-03-18,219150,True,"Great game! Bought it without thinking I would really like it because it was on sale, then I played it... Great action, strange story, chaos and skull smashing fun!I cant wait to buy Hotline Miami: The Wrong Number BUT IT IS BANNED IN AUSTRALIA D:<"
2016-02-20,304030,False,Pay 2 Win
2016-08-15,222880,True,وهناك لعبة كبيرة مع الكثير من قتل الكافر والقصف. لقد كان الكثير من الوقت لعبة ممتعة بين المجتمعات عبادة العظيمة التي هي في التمرد طالما زوجين من غير المؤمنين.أيضا إذا كنت حقا ذهب إلى حد أن يترجم هذا، آسف لديسابوينت لك.٩/١١
2015-03-21,259080,True,/tp airport was hectic
2016-07-26,211820,True,In short it's a magical experience with what seemingly is devs who keep on updating the game with the major downside of the rare save wipes. (But when it happens it's hell).To at least reduce damage done after a wipe take a ♥♥♥♥ton of screenshots like me and that will help.
2016-04-12,394690,True,"I cannot say much right now due to the game not even being in versions 1, and because of that there are only 4 gamemodes right now.   They are:-Mini Golf (Very fun, I didn't think I would enjoy the mini gold as much as it is strangely addicting)-Ball Race (Definitely a challenge but fun if done correctly)-Planet Panic (UFO Cats VS Dogs trying to retrieve as many 'animal pods' as possible to their base)-Virus ♥ (VERY fun to play especially with friends, though the crashing will occur especially on virus, and when it does it      is very annoying) On top of those gamemodes there is condo making which I am really getting into. Something about playing mini games based on skill and knowledge that rewards me with ingame currency that I can spend on making a nice home is oddly satisfying.Right now the player population isn't that big but from the people that I have spoken to they have been very nice and accepting of every player.So if you can get by the crashes, the fact that there might not be a certain gamemode with lots of people on it, the game only have 4 gamemodes and having a somewhat small population, why don't you come join us at the tower and support this game.I can assure you that the game blossum with your support."
