posted,item_id,recommend,review
2015-07-03,319510,True,Pingas.
2015-07-02,4000,True,Gmod e um Otimo jogo tenho faz Tempo Bom pra Zuar e Deixa seu PC Com Mods
2015-06-08,333930,False,Gente Não Comprem ese jogo E so pra entrar ate o Ngs AntiCheat Voce Pode baixar gta 5 Varias vezes Voce entra no jogo e fica falando conexão de internet resumindo tudo o jogo e uma ♥♥♥♥♥
2015-03-06,348090,True,Infamous Mask
2014-09-23,218620,False,"O que posso dizer de um Jogo que Foi estragando por dlcs Ridiculas?Totalmente Sabemos que payday 2 antes dessas bobagens de skins e hackers e dlcs era meio chatinho mais,o Jogo Não podia Ficar tao bobo assim Goat Simulator Nova Dlc skins e armas so falta ter hats pra ser igual team fortess 2 eu n reclamo da jogabilidade e ate boa mais,minhas configurações passam da adequada pra ter um otimo grafico alem de algumas travadas, e o jogo crashando sem hoxhud E ♥♥♥♥ ate isso Mais o que acho que payday  n tinha tanto sucesso que nem antes  o payday the heist como podem verem se voce for agora la na comunidade dele ou no facebock Voce vai ver que o jogo não tinha bastante sucesso Por Outro Lado..., O Jogo e legal ate,as soudtracks do jogos sao muito boas e o modo de jogabilidade rush tambem stealth e chatinho mais alguns são Ate legais eu me lembro que Quando eu tinha um pc bosta sempre quis payday,eu n era muito popular mais quando eu vi payday the heist e payday 2 Eu resolvi gastar meu dinheiro nas sale Jogei o heist amei, so que queria o payday 2 quando em agosto vi payday 2 50% Cheguei da escola vi aquilo na hora imprimi o boleto antes que a loterica fechava,paguei o jogo logo meu amigo Que n prefiro falar o nome mais e uma boa pessoa me deu Todas as keys DELE pra Compras todas as dlcs,So tinha ate o sniper pack Mais amei por outro lado o jogo travava bastante ai chegou outubro falei pro meu pai que alem do grafico pareçe de masinha e todo lagadow Meu pai comprou uma gtx 550 logo em seguida formatamos o pc salvei payday 2 acordei de manha fui direto pro Pc Jogar payday 2 E Vi aquilo sem nenhum lag mais que felicidade que eu estava nunca jogei um jogo assim, sem lag ou com grafico bom. bem tem mais historia por ai mais vou parar por aqui entao gente payday 2,N e que eu acho que ele e ruim,so que ele mudou muito"
2014-06-22,24240,True,"Otimo Jogo Belos ,Graficos Recomendo aproveinte o que estao esperado :D?"
2013-12-08,1250,True,eselente esa e a velosidade masima para o evento you tobe:?:.com .br @camp Killing Floor
2013-09-29,730,True,Mode Competitive                                                                                                                               19:06 - Le Fenicoto: PREVI19:06 - Le Fenicoto: QUEBREI A ♥♥♥♥♥ DA MINHA MESA19:06 - Le Fenicoto: QUEBREI A JANELA19:06 - Le Fenicoto: TB19:06 - Le Fenicoto: NESSA ♥♥♥♥♥                                                                                                     Previa its Payday Fellas :3
