posted,item_id,recommend,review
2016-01-29,274190,True,really fun even if its single or coop
2016-01-29,224260,True,fun
2016-01-28,265930,True,this game makes me laugh and have fun i recommand buying it
2016-01-28,219640,True,i recommand this its so fun u probably wont get bored for awhile playing this ♥♥♥♥
2016-01-28,730,True,if your looking for a really good shooter game this is the best one
2016-01-25,4000,True,probably one of the best games ive played
2016-01-24,304930,True,great game i recommend  getting its super fun
2016-01-14,337320,True,really fun game might need some fixing on some glitches but still fun
