posted,item_id,recommend,review
2014-12-23,9480,True,Smoked Weed In Front Of A Cop Started Shooting At Me Shot At An Old Man Thru His Walker On The Road And Bolted XD 10/10
2015-01-01,440,True,100000000000000/10 ign my hours on this game broke the system SO I HAD TO UNISTALLL and lost all my unusuals sad story 4 all of us m8
2014-12-12,332800,True,Pros:Alot HarderNew ScreamsNew CharactersIts A PrequalCons:2 SPOOKY 4 MELOVE AND H8
2014-11-03,319510,True,When I saw people play this game and how much credit the game got I thought people were turning into ♥♥♥♥♥s but when i bought the game and completed it I changd and loved it its a genuinely scary game and I recomend to anyone who loves a goood jump scare!
2014-08-24,221100,True,I Just Bought The Game And For AnyOne Who Likes It But Is Not Sure Cause Its in alpha its not that bad at the start ther is a screen resoloution glitch but google that and problem fixed not that many bugs to ruin the fun all round great gamplay love it!
2013-09-13,620,True,Great Game Keeps You In For Hours!!
