posted,item_id,recommend,review
2016-05-18,384300,True,"A great Fps Booster it really worked for me, I have a pretty bad pc but with this i could play doom! A tiny bit over price'd for me because i live in australia so it was $30 or so, anyway a great tool for boosting you're fps!"
2016-05-14,379720,True,"An awesome game with lots of guns and gore! great gameplay, It's awesome!"
2014-12-01,1250,True,good game get it
2016-03-18,232090,True,Game runs ♥♥♥♥ on my pc 11/10 gg
2015-11-17,10090,True,i ♥♥♥♥ing love this game
2015-08-09,550,True,what can i say for left 4 dead 2 it's just awesome!
2015-07-25,9050,True,i like this game and it's a good game it's got some good scares and the bfg so its a 5/10 also those hell knight asses are freaking amazing
2015-07-24,298240,True,its a good game yeah it's a Early Access Game but its still good i give it a 7/10
