posted,item_id,recommend,review
2016-03-16,201810,False,the fact that you think you can actually shoot things with a gun in this game is upsetting.
2016-03-16,261180,True,it went fast
2016-03-16,219150,True,this game is fading out of vision  slowly i can't quite seem to see ithelp?
2016-03-16,91700,True,"Grab your Bachelors degree in philosophy and plug it in by usb and it will produce this game, same with your bachelors degree of being sick"
2016-03-16,730,True,You have to stand still to shoot in this game
2016-03-16,363970,False,In this game you can
2016-03-16,274190,False,this games so sick it crashes when you try to play it despite it being made on  a sprite machine
