posted,item_id,recommend,review
2015-06-04,730,True,ESTE JUEGO ESTA MUY OP PERO IGUAL AMI ME GUSTA MICRAFT
2014-01-13,440,True,hola
2015-03-02,570,True,DOTA el juego donde esta lleno de peruanos que esriben con faltas de ortografia dota es mi ♥♥♥♥ vida lo amo mas que a mi mama esto es de verdad no mentira el amor que le tengo es mas grande que el del wilires XD.Es uno de los mejores juegos moba que juge en mi vida es divertido para jugarlo con amigos putiearse y manquearla un rato yo creo que si jugas dota te vas a llevas varias horas de juego como es en el caso de todos TE AMO VALVE AHCEME UN HIJO
2015-02-23,252490,True,AMO A RUST Y LE COMO LA BANANITA
2015-01-11,4000,True,Morite di mas vesos que la penetracion en un video pirnoTEFAKALAFAKA: Porno
