posted,item_id,recommend,review
2014-06-26,105600,True,"Very addictive and very challenging,if you love minecraft,2D game,sandbox,and survival this is the right game for you"
2014-09-24,49520,True,Teach me how to become badass10/10 would be a badass again
2016-02-06,200510,True,Sniper with 86% chance to hit*missHeavy with LMG have 16% chance to hit*critical hitMiss/10
2015-06-18,206190,True,Watch dog: Low budget edition
2015-06-16,211820,True,Terraria in space
2015-12-21,299360,True,Team fortress+Minecraft=This game
2014-07-17,304930,True,Kicked by my own serverRate:7/10
2014-05-31,265930,True,You're a goat.That's All
2014-05-31,222900,True,"need some asia server,but still...is the best ZOMBA game i ever played"
2014-05-30,274190,True,Total Destruction Simulator 2014
