posted,item_id,recommend,review
2014-01-15,252490,True,Rust is one of the best survival game iv'e ever played if you want a good game to play this would be what to buy and its pretty cheap too
2014-07-26,304930,True,Amazing Fun game and good frames i play lots of games like dayz and rust but never had so much fun
2014-06-28,237110,True,The game is so awesome it is one of the best fighting games i have ever played it has a good story and good charactars 10/10
2013-12-28,8980,True,Borderlands: Game of the Year is one of the best games iv ever played its got awesome boss battles and amazing guns if you want a game where you don't get board after playing it after a couple days this is what i would get
2013-12-05,230410,True,This Game is amazing i would give this Game a 10-10 Because the way it plays and everything is just Amazing
