posted,item_id,recommend,review
2016-07-13,17470,True,"still dunno if space died in the end watta good cliff hanger 10spookyskeletons/10spookyskeletonsupdate:played dead space 2 on PS3 way better, pretty sure its just a bad pc port doe"
2016-07-13,304930,False,i was very surprised to find that i could turn in the game >:(. i was dead set on not turning when i read the title
2016-07-13,42910,True,"i thought this would be bad but the game was like 'suprindur' and i'm like, im sold this is a good game"
2016-07-13,12210,True,the best of the auto theft gayms
2016-07-13,70,True,Advanced graphics mmmmmm
