posted,item_id,recommend,review
2015-01-03,292120,True,เกมนี้ทำผมร้องให้ T.T น่าซื้อครับคุ้มตังดี ถ้ามีตังว่าจะจัด XIII-2 ซักหน่อยสนุกมากครับซื้อเลยรอไร
2015-03-31,311730,True,ไม่อยากจะยกให้เท่าไหร่เลย แต่ยังมีข้อดีอยู่มาก ตัวเกมทำออกมาได้ดีทีเดียวพอทออกมาดีถึงแม้จะมีบางระบบไม่ได้ตามมาก็เถอะ (คงตามมาที่หลัง)โดยรวมตัวเกมสนุกมาก ถึง มากที่สุดแต่! DLC แพงโฮก แต่ก็ได้หลายชุดน่าจะคุ้ม อยากให้เกมนี้มี Card นะ และก็อยากให้เอา Achievements มาด้วยนะ เพราะคงจะมีเป้าหมายเล่นมากกว่านี้เกมนี้โดยรวมน่าซื้อไว้เป็นเจ้าของนะ
2015-03-05,218620,True,เป็นเกมที่คู่ควรซื้อมาติดไอดีไว้นะ สนุกดีผมชอบ
2013-12-27,8870,True,อลิสจัง โม มากๆครับเกมนี้แนะนำให้ลองเล่นดูครับสนุกมาก
2013-12-27,72850,True,เป็นเกมที่ผมเล่นจนจบไม่ยาก......แต่ทำไมมันใช้เวลานานมาก...เกมนี้ดีมากครับโดยเฉพาะ MOD แจ่มมวกๆ...
2013-12-14,203160,True,สนุกมาครับเกมนี้ เนื้อเรื่องก็พอใช้ได้นะคะแนนก็พอได้ รวมๆแล้วเกมนี้ใช้ได้เลย ส่วนตัวผมว่าเกมนี้สนุกมากแต่ก้อดสงสัยไม่ได้ว่าเจ้แกซวยขนาดนี้นเลยหรอ
