posted,item_id,recommend,review
2014-04-02,265930,True,"Walked into house, hits bookshelf, cause massive destruction, car blows up11/10"
2015-01-26,313120,True,I was building my house...A Tsunami glitch happenedhttp://steamcommunity.com/sharedfiles/filedetails/?id=38172058410/10 Would build again...
2014-04-12,264140,True,My ship is covered in all sorts of poo...10/10PGOTY
2014-03-06,244450,True,"There are chickens in the game, THEY'RE also a weapon!!11/10GOTY!!!"
2014-01-10,221910,True,You will buy this game. You will not buy this game. The game sucks. The game doesn't suck. You will love it. You will not love it. It's worth it. it's not worth it. #THEENDISNEVER
2013-11-30,4000,True,GET THIS ♥♥♥♥ING GAME AND ♥♥♥♥ EVERYTHING NOW!!!!            I MEAN IT!!!STOP READING
