posted,item_id,recommend,review
2014-04-19,45100,True,"Secrets of the Magic Crystals stole my life! If you are into cod, civ 5, borderlands, dota, portal or anything!Then you will ♥♥♥♥ing love this game!Willing to buy it for you!I figured out how to win this game. And ive done it 64 times.I hope Secrets of the Magic Crystals gets ported to phones so I can play anywhere, anytime.I RECOMMEND BUYING THIS GAME"
2014-04-25,49520,True,Unfortunately this game was not like people expect. I was hoping it to be about border patrol. It Wasnt. The Borderlands arent what you think. Very Cartoonish. Most people will not enjoy this.10/10
2013-11-28,210770,True,"Great game, very addictive and now worth 3 dollars."
2014-04-24,219640,True,"This game is quite fun, and can be very addicting. This was a little too futuristic for my liking, but if you are into lasers and plasma guns and stuff then buy this game."
2014-04-19,10180,True,"Personally, I didnt really enjoy this game. I thought tey could have done better and I regret buying it. Yeah. Includes Multiplayer"
2016-04-22,433850,True,I love this game! Would recommend 10/10 Its awesome now so I cant imagine what full game release will be like
2015-12-23,34900,True,gret
