posted,item_id,recommend,review
2016-08-12,306460,True,For everyone who downloaded this game I suggest you to buy the Gold Upgrade if you have friends to play with and if you play this game a lot so yea but I still suggest to play this game it is amazing
2016-08-03,271590,True,I suggest people to buy and play this game but if you have friends to play if you are alone and don't have anyone to play with buy it when they have it or if you have a friend that has it. But at the end I do suggest you to buy this game it is a great game with a good story.
2016-06-25,264710,True,Very amazing and cool game I must say I really like the graphics overall and how the game is improving all the time and how the developers are improving it and that they listen to the community and the youtubers great game overall I suggest you to buy if you like exploration games like Subnautica.
2016-06-23,218620,True,Pay day 2 is a very interesting game with many elements to it and having many updates and frequent updates makes the game still living and still alive for everyone I do suggest to buy it if you have friends you can play with since this game depends mostly on friends if you want real fun but overall it is a fun game
2016-08-19,431240,True,Must buy if you have friends it may seem boring but it is a very fun game!
2016-02-08,359550,True,The most competitive game I ever seen!
