posted,item_id,recommend,review
2015-10-14,304930,True,"Eu gostei, mas devia ter mais opções de lar/casa , além dos craftings serem bem dificeis as vezes , mas gostei bastante :D parabéns para o jogo"
2016-02-10,248570,True,"I love this game!!! i just think this game should be more simple/easy to play! but cool game,i love the replays,i love the mods, i love the spares,well....I LOVE THIS GAME!!!!!!!!!!!!!!!"
2014-02-20,570,False,Cara não GoStEi
2016-01-06,255710,True,"Esse jogo é tão bom, além de ter gráficos fantásticos para você poder tirar screenshots, o gameplay é muito bom!!!! uma dica,se você puder comprar e jogar este jogo,faça isso!!!"
2014-12-29,1840,True,"gostei muito é um software criado para fazer animações,obrigado por disponibilizar grátis Valve e gabe newell"
2014-05-05,243870,True,"Muito bom adorei,só acho que precisa de mais classes"
2014-02-22,440,True,YEY
2014-02-20,239820,True,eu gostei :3
