posted,item_id,recommend,review
2013-12-20,440,True,yes shoot all ze class
2013-12-17,261030,True,yes i f like the origonal youll like this
2014-08-18,264140,True,my captain fell into the water and drownd 10000000000/10
2014-08-21,218230,True,the vanu sovereignty are gonna Nuke the new conglomerate and rip the terran republic in part but siriously is fun
2014-07-05,205100,True,its good 
2014-05-22,204450,True,great probs best in series
2014-02-10,250320,True,yes very goood very good best werewolf simulator ever
2014-01-02,55230,True,very good game funny good funny much  funny very geod wow
2013-10-06,72850,True,FUS RO DA AND YOULL LOVE THE GAME MORE THAN A FLUFFY DOVAKIN
