posted,item_id,recommend,review
2015-12-24,298030,True,"Hands down the best RTS game. Thousands of hours wasted in my youth setting up precision attacks with air, land and sea units. Not to mention creating defensive bases that no AI could ever breach, even when you had ten players on a 64x64 map all allied against you.What C&C and Starcraft failed to deliver, TA has covered.About time this came to Steam."
2014-09-18,301520,True,"Fantastic game, great concept, easy to play and fun to build robots to battle with."
2014-09-05,15320,True,Good WW2 flight sim. Graphics are dated and in need of update.Good game for those who are interested in flight sims.
2014-06-28,107410,True,The best ARMA to date. Does need more weapons and vehicles.
2014-06-28,226700,False,"Was a great concept, pre DayZ.But pay to win, no way."
2014-06-27,265930,True,"Great Time Waster. Awesome if you can grab it cheap, (sub $5) and allows a lot of replayability.Not short of bugs, but still fun."
2014-05-31,35450,True,"Fantastic FPS. Good pace, not to fast like COD but still requires teamwork to succeed.Great for any WW2 or shooter fan."
