posted,item_id,recommend,review
2015-12-10,250900,True,IT'S ♥♥♥♥♥♥♥T IT'S ♥♥♥♥♥♥♥T IT'S ♥♥♥♥♥♥♥T IT'S ♥♥♥♥♥♥♥T IT'S ♥♥♥♥♥♥♥T IT'S ♥♥♥♥♥♥♥T IT'S ♥♥♥♥♥♥♥T IT'S ♥♥♥♥♥♥♥T IT'S ♥♥♥♥♥♥♥T IT'S ♥♥♥♥♥♥♥T IT'S ♥♥♥♥♥♥♥T IT'S ♥♥♥♥♥♥♥T IT'S ♥♥♥♥♥♥♥T IT'S ♥♥♥♥♥♥♥T IT'S ♥♥♥♥♥♥♥T IT'S ♥♥♥♥♥♥♥T IT'S ♥♥♥♥♥♥♥T IT'S ♥♥♥♥♥♥♥T IT'S ♥♥♥♥♥♥♥T IT'S ♥♥♥♥♥♥♥T IT'S ♥♥♥♥♥♥♥T IT'S ♥♥♥♥♥♥♥T IT'S ♥♥♥♥♥♥♥T IT'S ♥♥♥♥♥♥♥T IT'S ♥♥♥♥♥♥♥T IT'S ♥♥♥♥♥♥♥T IT'S ♥♥♥♥♥♥♥T IT'S ♥♥♥♥♥♥♥T IT'S ♥♥♥♥♥♥♥T IT'S ♥♥♥♥♥♥♥T IT'S ♥♥♥♥♥♥♥T IT'S ♥♥♥♥♥♥♥T IT'S ♥♥♥♥♥♥♥T IT'S ♥♥♥♥♥♥♥T IT'S ♥♥♥♥♥♥♥T IT'S ♥♥♥♥♥♥♥T IT'S ♥♥♥♥♥♥♥T IT'S ♥♥♥♥♥♥♥T IT'S ♥♥♥♥♥♥♥T IT'S ♥♥♥♥♥♥♥T IT'S ♥♥♥♥♥♥♥T IT'S ♥♥♥♥♥♥♥T IT'S ♥♥♥♥♥♥♥T IT'S ♥♥♥♥♥♥♥T IT'S ♥♥♥♥♥♥♥T IT'S ♥♥♥♥♥♥♥T IT'S ♥♥♥♥♥♥♥T IT'S ♥♥♥♥♥♥♥T IT'S ♥♥♥♥♥♥♥T IT'S ♥♥♥♥♥♥♥T IT'S ♥♥♥♥♥♥♥T IT'S ♥♥♥♥♥♥♥T IT'S ♥♥♥♥♥♥♥T IT'S ♥♥♥♥♥♥♥T IT'S ♥♥♥♥♥♥♥T IT'S ♥♥♥♥♥♥♥T IT'S ♥♥♥♥♥♥♥T IT'S ♥♥♥♥♥♥♥T IT'S ♥♥♥♥♥♥♥T IT'S ♥♥♥♥♥♥♥T IT'S ♥♥♥♥♥♥♥T IT'S ♥♥♥♥♥♥♥T IT'S ♥♥♥♥♥♥♥T IT'S ♥♥♥♥♥♥♥T IT'S ♥♥♥♥♥♥♥T IT'S ♥♥♥♥♥♥♥T IT'S ♥♥♥♥♥♥♥T IT'S ♥♥♥♥♥♥♥T IT'S ♥♥♥♥♥♥♥T IT'S ♥♥♥♥♥♥♥T IT'S ♥♥♥♥♥♥♥T IT'S ♥♥♥♥♥♥♥T IT'S ♥♥♥♥♥♥♥T IT'S ♥♥♥♥♥♥♥T IT'S ♥♥♥♥♥♥♥T IT'S ♥♥♥♥♥♥♥T IT'S ♥♥♥♥♥♥♥T IT'S ♥♥♥♥♥♥♥T IT'S ♥♥♥♥♥♥♥T IT'S ♥♥♥♥♥♥♥T IT'S ♥♥♥♥♥♥♥T IT'S ♥♥♥♥♥♥♥T IT'S ♥♥♥♥♥♥♥T IT'S ♥♥♥♥♥♥♥T IT'S ♥♥♥♥♥♥♥T IT'S ♥♥♥♥♥♥♥T IT'S ♥♥♥♥♥♥♥T IT'S ♥♥♥♥♥♥♥T IT'S ♥♥♥♥♥♥♥T IT'S ♥♥♥♥♥♥♥T IT'S ♥♥♥♥♥♥♥T IT'S ♥♥♥♥♥♥♥T IT'S ♥♥♥♥♥♥♥T IT'S ♥♥♥♥♥♥♥T IT'S ♥♥♥♥♥♥♥T IT'S ♥♥♥♥♥♥♥T IT'S ♥♥♥♥♥♥♥T IT'S ♥♥♥♥♥♥♥T IT'S ♥♥♥♥♥♥♥T IT'S ♥♥♥♥♥♥♥T IT'S ♥♥♥♥♥♥♥T IT'S ♥♥♥♥♥♥♥T IT'S ♥♥♥♥♥♥♥T IT'S ♥♥♥♥♥♥♥T IT'S ♥♥♥♥♥♥♥T.
2015-11-27,417860,True,did i do something wrong?i honestly can't tell.
2015-10-27,240,True,Everybody who plays is either a pro player or a hacker.
2014-06-30,440,True,One of the best hat sims i've played.Sucked out many hours from me trying to get an unusual.Also they may be shooting and killing with some of the best multiplayer idk.
2015-07-14,105600,True,i donz kno wat to tink aboot dis gaamne.tis 10/5 ign said nbope and agree with ign or cvod will eat yur brainz
2016-08-21,570,True,"You want some advice?Never take this game seriously.Ever.If you do you will see a different side of yourself.A side you never knew existed.A side which you have kept in the shadows, away from society.A side which consumes you.Changes your view on everything.Causes you to blame everyone else.Causes you to report for no good reason.Causes you to feed for the hell of it.Causes you to play again."
2016-02-19,220,True,I really tried to like this game. I really did. But in the end it was just eh
2015-07-01,8870,True,I went into a room full of cultists praising. There all said 'there he is' and tried to kill me. I shot them in the face. I then realised I took the good route.9/10 would massacre again for glob
2015-01-12,730,True,As soon as you buy a knife you will not want to play this game anymore.
