posted,item_id,recommend,review
2016-07-01,219740,True,*hatching tallbird egg**about to hatch**random pig appears**pig onomnoms egg**♥♥♥♥**burns pig village**roasted pigs**onomnoms pigs*10/10 will revenge again
2014-12-14,238460,True,Even the music itself is worth the money.
2015-12-15,730,True,"*rushes to A**sees smoke on bombsite with no one else around*Thinks to self: 'Sweet, my team smoked for me'*plants C4*~literally 8 seconds later~(Bomb has been defused newbs, anti-ISIS squad wins)*Team went wtf**smoke dispersed**A CT is seen crouching on the defused bomb**Gets kicked from game*9/11 will plant in suspicious cloud of smoke again"
2014-06-21,570,True,DOTY IZ DA URIGINAL MOBA GAIM. IT'S MUR ORIJINAL DEN LOL. DAT GAIM IZ NOT ORIJINAL. IT COPIED FROM DOTEA. PLAY DOTEA. DRINK TEA. BREAK YER MOUSE BY ABUSING RIGHT KLICKS. THROW YER MOUSE BCUZ KOTL DUN GIF MANA. PUNCH YER KOMPUTER CUZ Y NOT. PLEY DIZ. IZ VELLY GUD.
2016-06-10,424280,True,Them sick mid-air karate flips tho
2016-02-10,204360,True,Things that I have died to in this game:-huge ♥♥♥ pooping bat-a cat fish with laser eyes -literally a cob of corn-spooky spooky skeletons-a light saber wielding pianist-the light saber wielding pianist's dad-fish fillets armed with tridents -a shark wizard thingy-the zombie of the pianist and his dad-my own pet bear 10/10 will play and die again
