posted,item_id,recommend,review
2014-07-14,211820,False,▸ I immediately regret my decision
2015-06-22,221100,False,Gimme an epic upvote if this game and Starbound taught you to never buy early access again.
2014-05-19,34900,False,"Don't buy this, not even for the 50c price it is often on sale for. It's not 'so bad it's good'. It's just thoroughly unfun."
2014-01-23,212180,False,"Aimbots everywhere, pay2win, ugly, laggy, generic."
2012-10-12,570,True,okay so uh I just like got a preorder of this game after Reddit recomended it........ am I missing something.......?? this is just like a ripoff of LOL. all the heroes are just copys..? the champions are boring and unfunny and have no personalitys. and having all the champs at the start instead of having to pay 4 them........... uh news flash its a little overwelming to a newbie.... i just dont get what people see in it its just sad rly
2016-07-02,389510,True,"This game is hilarious, and the developer has an infectious passion for his product. Highly recommended."
2014-04-04,265930,False,Gets old fast. Not worth $10.
