posted,item_id,recommend,review
2016-01-04,208090,True,"its fun,its hard, its good to play when your rushed and up for a chalange i do and dont recomend it"
2016-02-16,440,True,Holey ♥♥♥♥
2015-06-22,105600,True,the best played on all 5 platforms love the comunity great support sure hard to get started and sometimes frustrateing but allways keep a internet tab open just incase :) all threwout its great i whould recomend 10/10
2014-08-13,304930,True,i cant play it keeps turning it off
2013-11-29,4000,True,BEST EVER BYE IT OR DIE!!!!!!!!!!!!!!!!!! HAHAHAAHAHHAAHAHAHA
