posted,item_id,recommend,review
2013-03-25,219150,True,One of my favourtie indie games. Has a die for soundtrack. The story is quite interesting and will keep you playing and with all the secrets there is replay value!
2012-07-12,38830,True,Pretty good free to play. But its one of those free to plays. Pay to win.
2011-12-27,3830,True,An interesting type of RPG I only got this game because I was going 2 get it on the orginal xbox and it was worth buying it now
2011-07-03,620,True,Great Game with alot of puzzles
2010-12-24,40800,True,Fast Paced Game Very Addictive
2010-11-26,550,True,Play This with freinds a hole lot more fun
