posted,item_id,recommend,review
2015-09-06,730,True,Эта игра является довольно прохладно :)
2015-06-06,333930,True,:)
2015-05-10,230410,True,Pew Pew :D
2015-05-08,113400,True,Havent Played it yet :)
2015-04-15,218620,True,"Sweet action packed game about stabbing people, stealing, blowimg up and stealthing.69/21 would bang again"
2014-08-07,301520,True,"This game is aweosme, it doesnt need you to spend money just to play like other games do. I Totally recommenf this :D"
2014-06-24,440,False,"You Have To pay $10 to play competitive, Valves Running out of money."
2013-09-06,236390,True,Its  An Awesome War game thet actually puts you in in the cockpit of the plane......hehe cockpit
