posted,item_id,recommend,review
2015-05-16,34900,True,  meme yes pls   John 65    ok   memes   memers  ok  ¯(ツ)/¯ 7/10 - alek
2014-06-19,17020,True,This games ♥♥♥♥.
2016-09-11,270550,True,zombies are my favourite fantasy characters apart from vampires but they can die from sun light and also wooden poles but zombies are allready undeads so they cant die again but this game is fantasy and they can die again. sorry for any spoilers and i hope i dont ruin anyones gameplay expereince
2014-07-13,214700,True,♥♥♥♥ off
2014-08-09,45760,True,its all right i guess
2016-07-03,322500,True,There is only mixed reviews because of 'lack of content' but there is heaps of replayability with different modes.
