posted,item_id,recommend,review
2015-07-03,346110,True,It's optimization is bad but the gameplay is addictive and very fun. Overall I recommend Ark Survival Evolved
2016-02-17,49520,True,"yo dis gaem is so ♥♥♥♥in gr8 it lik has ur frengds stealin yo guns an ♥♥♥♥ ♥♥♥♥♥, yo dis game is mah ♥♥♥♥."
2015-01-27,252490,True,"It's has very good graphics that is not suitible for many computers, some mechanics are still glitchy, There are tons of hackers which I find very sad, the Building Allowed thing is a bit glitchy, The picking up or taking thing is weird because you have to click the top of the object to take it all. Apart from all that the game is good."
2016-08-07,461560,True,This game was quite short but a fun learning experiece and is very satisfying when you finish playing it.
2015-08-17,389570,True,It is better than Agar.io cause facebook is ♥♥♥♥♥♥ :P.
2015-03-06,322330,True,MLG ♥♥♥♥ING GREAT GAME 10/10 ign rated
2014-08-30,204300,True,Good game
