posted,item_id,recommend,review
2014-03-12,251570,True,great game!watch gameplay before buying as it isnt for everyone. the trailer thing on the store page shows some of the features actually in it most of it is what they plan to add.multiplayer is a mixed bucket it can be fun but it can also be really annoying. such as when my base was blown up by a guy with a rocket launcher........overall i recomend it. i have played alot and im not bored.
2015-06-27,233250,True,gr8
2016-02-21,4000,True,People take things too seriousl. Trolling/10.
2016-02-21,300,True,very good m9.team killing/10
2014-05-14,730,True,EITHER DIE SOME CASUAL CAMPER NOOB WHO USES CASUAL WEAPONS OR LIVE TO BE A 
2013-12-21,220,True,this is one of the best games i have ever played! GET THIS GAME!
