posted,item_id,recommend,review
2015-07-20,304050,True,"Very addicting. Very good. Very fun. 10/10.Worst part is, I keep getting this error when starting the game! Please help! (The error is #1033, it's been happening for a week now)"
2014-08-17,440,True,"Team Fortress Two. A funny, cartoon-looking game. COD, BattleField, may be better but this game is just to fun! 10/10 :D"
2016-06-22,311210,False,S**** game.Thats all i need to say.
2015-08-10,218620,True,"Great game, really fun to play with friends. The DLC is a little overpriced, but you can still have fun without it. Loads of content, really fun once again. :)"
2015-05-20,342970,True,"Pretty good, don't recommend buying this game in early access though. It has great potential in the future, cant wait too see it! :D"
