posted,item_id,recommend,review
2015-12-09,250900,True,i used to have a life10/10
2015-12-09,391540,True,its hecking fantastic mateys :))))))))
2015-09-18,4000,True,i dont get it
2015-09-12,105600,True,dis gam rips of mincrfat so much i cnt ♥♥♥♥♥ bleve it mateys. do not by this gaym if yu h8 minecrfat rip offz im out bois10/10
2015-10-15,71250,True,IT'S NOT AS GOOD AS SONIC 3 AND KNUCKLES PFFTNJTNSIENFAIUFNUIFUEBNFGJERNGIUENGUNERIGUNERUIGNERREGREGNo it's good
2016-06-25,377160,True,haha kill son or nuke your ♥♥♥♥ing uncle!!!!
2016-06-26,383980,True,animal smash bros is fun
2015-09-18,323470,True,145235/10 too much krillin
2015-04-13,213610,True,0/10 Removed Big stages
