posted,item_id,recommend,review
2015-07-11,306130,True,its a good crashing simulator 1010
2016-03-22,435870,True,built a massive death machine. his name is Fluffy
2015-11-11,377160,True,starts gamepicks nosemakes wife wife dieswatches son get takenbusts out of vault to fine son but firstbuilds 2 setllementsjoins the brotherhooduse consoule commandsbecomes god neglects son1010 would neglect son again wait didnt the real god do the same thing
2016-06-21,480630,True,"its a good add on made by bethesda, and they were nice and gave this one a price drop"
2016-06-18,211420,True,Prepare to die die die again and again and again in a game that made for people that like to die on the inside and like felling a nine tail whip hitting them in the back every time they see that fiery red text telling them that they've died for the 1378453920 time.9/10 praise the sun
2016-01-30,219150,True,starts game:rrrrrrrrrrrrrrrrrrrrrrrrrrrrrrrrrrrrrrrrrrrrrrrrrrrrrrrrrrrrrrrrrrrrrrrrrrrrrrrrrrrrrrrrrrrrrrrrrrrrWIN
