posted,item_id,recommend,review
2015-10-30,218620,False,gayday2 global offensive! As if we haven't had enough.
2016-03-30,301520,False,pay2win
2015-11-17,302830,False,bad bad bad bad bad bad bad bad bad bad bad bad bad bad bad bad bad bad bad bad bad bad bad bad bad bad bad bad bad bad bad bad bad bad bad bad bad bad bad bad bad bad bad bad bad bad bad bad bad bad bad bad bad bad bad bad bad bad bad bad bad bad bad bad bad bad bad bad bad bad bad bad bad bad bad bad bad bad bad bad bad bad bad bad bad bad bad bad bad bad bad bad bad bad bad bad bad bad bad bad bad bad bad bad bad bad bad bad bad bad bad bad bad bad bad bad bad bad bad bad bad bad bad bad bad bad bad bad bad bad bad bad bad bad bad bad bad bad bad bad bad bad bad bad bad bad bad bad bad bad bad bad bad bad bad bad bad bad bad bad bad bad bad bad bad bad bad bad bad bad bad bad bad bad bad bad bad bad bad bad bad bad bad bad bad bad bad bad bad bad bad bad bad bad bad bad bad bad bad bad bad bad bad bad bad bad bad bad bad bad bad bad bad bad bad bad bad bad bad bad bad bad bad bad bad bad bad bad bad bad bad bad bad bad bad bad bad bad bad bad bad bad bad bad bad bad bad bad bad bad bad bad bad bad bad bad bad bad bad bad bad bad bad bad bad bad bad bad bad bad bad bad bad bad bad bad bad bad bad bad bad bad bad bad bad bad bad bad bad bad bad bad bad bad bad bad bad bad bad bad bad bad bad bad bad bad bad bad bad bad bad bad bad bad bad bad bad bad bad bad bad bad bad bad bad bad bad bad bad bad bad bad bad bad bad bad bad bad bad bad bad bad bad bad bad bad bad bad bad bad bad bad bad bad bad bad bad bad bad bad bad bad bad bad bad bad bad bad bad bad bad bad bad bad bad bad bad bad bad bad bad bad bad bad bad bad bad bad bad bad bad bad bad bad bad bad bad bad bad bad bad bad bad bad bad bad bad bad bad bad bad bad bad bad bad bad bad bad bad bad bad bad bad bad bad bad bad bad bad bad bad bad bad bad bad bad bad bad bad bad bad bad bad bad bad bad bad bad bad bad bad bad bad bad bad bad bad bad bad bad bad bad bad bad bad bad bad bad bad bad bad bad bad bad bad bad bad bad bad bad bad bad bad bad bad bad bad bad bad bad bad bad bad bad bad bad bad bad bad bad bad bad bad bad bad bad bad bad bad bad bad bad bad bad bad bad bad bad bad bad bad bad bad bad bad bad bad bad bad bad bad bad bad bad bad bad bad bad bad bad bad bad bad bad bad bad bad bad bad bad bad bad bad bad bad bad bad bad bad bad bad bad bad bad bad bad bad bad bad bad bad bad bad bad bad bad bad bad bad bad bad bad bad bad bad bad bad bad bad bad bad bad bad bad bad bad bad bad bad bad bad bad bad bad bad bad bad bad bad bad bad bad bad bad bad bad bad bad bad bad bad bad bad bad bad bad bad bad bad bad bad bad bad bad bad bad bad bad bad bad bad bad bad bad bad bad bad bad bad bad bad bad bad bad bad bad bad bad bad bad bad bad bad bad bad bad bad bad bad bad bad bad bad bad bad bad bad bad bad bad bad bad bad bad bad bad bad bad bad bad bad bad bad bad bad bad bad bad bad bad bad bad bad bad bad bad bad bad bad bad bad bad bad bad bad bad bad bad bad bad bad bad bad bad bad bad bad bad bad bad bad bad bad bad bad bad bad bad bad bad bad bad bad bad bad bad bad bad bad bad bad bad bad bad bad bad bad bad bad bad bad bad bad bad bad bad bad bad bad bad bad bad bad bad bad bad bad bad bad bad bad bad bad bad bad bad bad bad bad bad bad bad bad bad bad bad bad bad bad bad bad bad bad bad bad bad bad bad bad bad bad bad bad bad bad bad
2015-12-23,225600,False,"if you play with idiots with high pings, they're going to grapple you from 200000m away. ridiculous game, advantage to people with horrible internet"
2015-01-16,222900,False,No asian severs.
2015-12-03,418340,True,good.
2015-11-23,417860,True,its hard to get into myself though
2015-08-18,730,False,"Cancerous game, wanted to join competitive game but as soon as I got it I started losing connection and the game kept being unresponsive. So instead, the game decided to just give me a 30min ban. Nice!"
2014-05-07,223470,True,pls you can pee on things100/10
