posted,item_id,recommend,review
2015-01-22,308420,True,"A 3D, First-person, Binding of issac - Mixed with Lichdom Battlemage!"
2016-02-26,322500,True,SUPERHOT IS THE MOST INNOVATIVE SHOOTER I'VE PLAYED IN YEARS! Use this discount and join me now : http://superhotgame.com/discount/#BFD91D9B0341
2015-02-04,205100,True,One of my most favourite games of all time.
2015-06-08,730,True,pretty good
2014-12-17,206190,True,One of my favourite games of all time.
2014-11-16,242760,True,2 SPOOKY 4 ME
2014-09-29,218620,True,Best. game. ever.10/10 would review again
2014-05-19,244850,True,"Great, Fun exploration/creation game full of fun and laughter with your friends. great single and multiplayer. great for building whatever you want!"
2013-12-19,41070,True,Serious sam 3 BFE is a great FPS shoot 'em up. it has good graphics with lots of blood and gore. great sound and lots of cheesy puns. this game is great for its funny and exciting action packed story and its great array of weapons and alliens. 8/10
